type of dye,type of fungi,concentration of dye,concentration of fungi,method of agitation,temperature,duration,pH,decolorization result,"whether the fungi was mycellium, fungal mass or whole fungi",any additional information
red formazane,n/a,50 mg/l,n/a,shaken for 30 minutes,n/a,n/a,n/a,n/a,n/a,"Used both activated carbons A and B, experiments repeated five times"
red formazane,n/a,n/a,n/a,n/a,n/a,n/a,n/a,sorption capacity of AC-A is 4.24*10-3 g/g,n/a,AC-B has sorption capacity of 6.1*10-3 g/g
n/a,n/a,n/a,n/a,n/a,n/a,n/a,n/a,n/a,not dried biomass,"BAS-A showed increased sorption capacity, BAS-B showed reduced sorption capacity compared to the reference"
n/a,n/a,n/a,n/a,n/a,n/a,n/a,n/a,n/a,dried biomass,"Sorption capacity of BAS-B decreased significantly, by more than five times"
n/a,n/a,n/a,n/a,n/a,n/a,n/a,n/a,n/a,n/a,"During the biosorption process, AC-A was regenerated by film of microorganisms"
