type of dye,type of fungi,concentration of dye,concentration of fungi,method of agitation,temperature,duration,pH,decolorization result,"whether the fungi was mycellium, fungal mass or whole fungi",any additional information
Crystal Violet,Rhodococcus pyridinivorans,0.6 mM,10% (v/v),shaking,30°C,24 h,not specified,73 ± 3%,whole fungi,Comparison with static condition (43 ± 2%)
Crystal Violet,Rhodococcus pyridinivorans,0.6 mM,12% (v/v),shaking,45°C,12 h,7,91 ± 2%,whole fungi,Optimized culture conditions
Crystal Violet,Rhodococcus pyridinivorans,0.3 mM,12% (v/v),shaking,45°C,12 h,7,94 ± 1%,whole fungi,Higher concentration of dye leads to reduced removal
Crystal Violet,Rhodococcus pyridinivorans,0.6 mM,4% (v/v),shaking,45°C,12 h,7,67 ± 2%,whole fungi,Ineffective removal at lower inoculum concentration
Crystal Violet,Rhodococcus pyridinivorans,0.6 mM,20% (v/v),shaking,45°C,12 h,7,49 ± 1%,whole fungi,High inoculum concentration limits nutrient availability
Crystal Violet,Rhodococcus pyridinivorans,2.4 mM,10% (v/v),shaking,45°C,12 h,7,8 ± 1%,whole fungi,Significant reduction in decolorization efficiency at high dye concentration
Crystal Violet,Rhodococcus pyridinivorans,0.6 mM,10% (v/v),shaking,45°C,different cycles,7,up to 39 ± 1% after 10 cycles,whole fungi,Repeated dye addition study showed decline in efficiency after 4 cycles
