type of dye,type of fungi,concentration of dye,concentration of fungi,method of agitation,temperature,duration,pH,decolorization result,"whether the fungi was mycellium, fungal mass or whole fungi",any additional information
Crystal violet,Amycolatopsis orientalis SY6,10 µg/ml,Not specified,Not specified,30 °C,5 minutes,Not specified,Potent decolorizing ability,Whole fungi,Clearing of the dye was visible just five minutes after incubation.
Crystal violet,Amycolatopsis orientalis SY6,10 µg/ml,Not specified,Not specified,30 °C,10 minutes,Not specified,Dramatic decrease in intensity on TLC,Whole fungi,Four main bands were observed from 5-20min.
Crystal violet,Amycolatopsis orientalis SY6,10 µg/ml,Not specified,Not specified,30 °C,20 minutes,Not specified,Further degradation confirmed,Whole fungi,The lowest band was no longer visible at 30 min.
Crystal violet,Amycolatopsis orientalis SY6,10 µg/ml,Not specified,Not specified,30 °C,30 minutes,Not specified,No detection of lower bands,Whole fungi,Analysis via thin layer chromatography.
Crystal violet,Amycolatopsis orientalis SY6,30 µg/ml,Not specified,Not specified,30 °C,Prolonged incubation,Not specified,No ability to decolorize beyond this concentration,Whole fungi,Acclimatization improved decolorization capacity.
Various,Amycolatopsis orientalis SY6,Not specified,Not specified,Not specified,Not specified,Not specified,Not specified,Ability to decolorize multiple dyes,Whole fungi,Combined triphenylmethane dyes decolorized effectively.
Various,Amycolatopsis orientalis SY6,Not specified,Not specified,Not specified,Not specified,Not specified,Not specified,Complete detoxification,Whole fungi,Determined by monitoring E. coli growth.
